{
  "version": 1,
  "books": [
    {
      "id": "doi-ngan",
      "title": "Đời ngắn đừng ngủ dài",
      "author": "Robin Sharma",
      "topic": "Sống tích cực",
      "cover": null,
      "description": "Đầu sách do chủ thư viện nêu trong danh sách ban đầu. Chưa nhận PDF để xác minh nội dung, ấn bản và mục lục.",
      "status": "pending",
      "rights": "unknown",
      "featured": true,
      "sections": [],
      "sources": [],
      "mindmap": [],
      "illustrations": []
    },
    {
      "id": "enzyme",
      "title": "Nhân Tố Enzyme – các tập",
      "author": "Hiromi Shinya",
      "topic": "Sức khỏe và lối sống",
      "cover": null,
      "description": "Đầu sách do chủ thư viện nêu trong danh sách ban đầu. Chưa nhận PDF để xác minh nội dung, ấn bản và mục lục.",
      "status": "pending",
      "rights": "unknown",
      "featured": false,
      "sections": [],
      "sources": [],
      "mindmap": [],
      "illustrations": []
    },
    {
      "id": "binh-phap",
      "title": "Binh pháp Tôn Tử trong kinh doanh",
      "author": "Becky Sheetz-Runkle",
      "topic": "Lãnh đạo và quản trị",
      "cover": null,
      "description": "Đầu sách do chủ thư viện nêu trong danh sách ban đầu. Chưa nhận PDF để xác minh nội dung, ấn bản và mục lục.",
      "status": "pending",
      "rights": "unknown",
      "featured": true,
      "sections": [],
      "sources": [],
      "mindmap": [],
      "illustrations": []
    },
    {
      "id": "sinh-ra-de-chay",
      "title": "Sinh ra để chạy",
      "author": "Christopher McDougall",
      "topic": "Sức khỏe và lối sống",
      "cover": null,
      "description": "Đầu sách do chủ thư viện nêu trong danh sách ban đầu. Chưa nhận PDF để xác minh nội dung, ấn bản và mục lục.",
      "status": "pending",
      "rights": "unknown",
      "featured": true,
      "sections": [],
      "sources": [],
      "mindmap": [],
      "illustrations": []
    },
    {
      "id": "power-force",
      "title": "Power vs. Force",
      "author": "David R. Hawkins",
      "topic": "Triết học và tư duy",
      "cover": null,
      "description": "Đầu sách do chủ thư viện nêu trong danh sách ban đầu. Chưa nhận PDF để xác minh nội dung, ấn bản và mục lục.",
      "status": "pending",
      "rights": "unknown",
      "featured": false,
      "sections": [],
      "sources": [],
      "mindmap": [],
      "illustrations": []
    },
    {
      "id": "tu-duy-trieu-phu",
      "title": "Bí mật tư duy triệu phú",
      "author": null,
      "topic": "Kinh doanh và tài chính",
      "cover": null,
      "description": "Đầu sách do chủ thư viện nêu trong danh sách ban đầu. Chưa nhận PDF để xác minh nội dung, ấn bản và mục lục.",
      "status": "pending",
      "rights": "unknown",
      "featured": false,
      "sections": [],
      "sources": [],
      "mindmap": [],
      "illustrations": []
    },
    {
      "id": "steve-jobs",
      "title": "Tiểu sử Steve Jobs",
      "author": null,
      "topic": "Lãnh đạo và quản trị",
      "cover": null,
      "description": "Đầu sách do chủ thư viện nêu trong danh sách ban đầu. Chưa nhận PDF để xác minh nội dung, ấn bản và mục lục.",
      "status": "pending",
      "rights": "unknown",
      "featured": false,
      "sections": [],
      "sources": [],
      "mindmap": [],
      "illustrations": []
    },
    {
      "id": "toi-tai-gioi",
      "title": "Tôi tài giỏi, bạn cũng thế",
      "author": null,
      "topic": "Học tập suốt đời",
      "cover": null,
      "description": "Đầu sách do chủ thư viện nêu trong danh sách ban đầu. Chưa nhận PDF để xác minh nội dung, ấn bản và mục lục.",
      "status": "pending",
      "rights": "unknown",
      "featured": false,
      "sections": [],
      "sources": [],
      "mindmap": [],
      "illustrations": []
    },
    {
      "id": "tri-tue-xuc-cam",
      "title": "Trí tuệ xúc cảm",
      "author": null,
      "topic": "Tâm lý học",
      "cover": null,
      "description": "Đầu sách do chủ thư viện nêu trong danh sách ban đầu. Chưa nhận PDF để xác minh nội dung, ấn bản và mục lục.",
      "status": "pending",
      "rights": "unknown",
      "featured": false,
      "sections": [],
      "sources": [],
      "mindmap": [],
      "illustrations": []
    },
    {
      "id": "thoi-quen-8",
      "title": "Thói quen thứ 8",
      "author": null,
      "topic": "Hiểu bản thân",
      "cover": null,
      "description": "Đầu sách do chủ thư viện nêu trong danh sách ban đầu. Chưa nhận PDF để xác minh nội dung, ấn bản và mục lục.",
      "status": "pending",
      "rights": "unknown",
      "featured": false,
      "sections": [],
      "sources": [],
      "mindmap": [],
      "illustrations": []
    },
    {
      "id": "ba-nguoi-thay",
      "title": "Ba người thầy vĩ đại",
      "author": "Robin Sharma",
      "topic": "Sống tích cực",
      "cover": null,
      "description": "Đầu sách do chủ thư viện nêu trong danh sách ban đầu. Chưa nhận PDF để xác minh nội dung, ấn bản và mục lục.",
      "status": "pending",
      "rights": "unknown",
      "featured": true,
      "sections": [],
      "sources": [],
      "mindmap": [],
      "illustrations": []
    },
    {
      "id": "ty-phu-ban-giay",
      "title": "Tỷ phú bán giày",
      "author": null,
      "topic": "Kinh doanh và tài chính",
      "cover": null,
      "description": "Đầu sách do chủ thư viện nêu trong danh sách ban đầu. Chưa nhận PDF để xác minh nội dung, ấn bản và mục lục.",
      "status": "pending",
      "rights": "unknown",
      "featured": false,
      "sections": [],
      "sources": [],
      "mindmap": [],
      "illustrations": []
    }
  ],
  "music": [],
  "websites": []
}